{
  "kind": "scip-query-result",
  "schemaVersion": 1,
  "producer": {
    "name": "scip-query",
    "version": "0.25.0"
  },
  "resultSchemaVersion": 1,
  "command": "cycles",
  "operationRole": "repository-observation",
  "evidence": "graph-fact",
  "args": [],
  "options": {
    "maxDepth": 10,
    "json": true,
    "session": true,
    "jsonOutput": "/Users/aydansalois/Documents/GitHub/scip-query/benchmarks/full-tool-audit/2026-09-05/followup/final/cycles.json"
  },
  "result": {
    "cycles": [
      {
        "path": [
          "src/cycle/a.ts",
          "src/cycle/b.ts",
          "src/cycle/a.ts"
        ],
        "component": [
          "src/cycle/a.ts",
          "src/cycle/b.ts"
        ],
        "edgeBasis": "symbol-references",
        "witness": true,
        "classification": "dependency-cycle",
        "kind": "real"
      }
    ],
    "truncated": false,
    "edgeBasis": "symbol-references",
    "maxDepth": 10
  },
  "coverage": {
    "complete": true,
    "totalKnown": true,
    "returned": 1,
    "total": 1,
    "omitted": 0
  },
  "evidenceContext": {
    "schemaVersion": 1,
    "operationRole": "repository-observation",
    "receipt": {
      "schemaVersion": 2,
      "observedAt": "2026-09-06T03:42:56.423Z",
      "facts": {
        "index": {
          "generation": {
            "schemaVersion": 1,
            "canonicalizationVersion": 1,
            "hashAlgorithm": "sha256",
            "projection": {
              "name": "scip-query:index-generation",
              "version": 1
            },
            "digest": "5f5af108211ca4cbc96039e19fd54c8883c58afac704157b2a864eac2df1349e"
          },
          "source": "immutable"
        }
      },
      "observedSources": [
        {
          "kind": "index-generation",
          "identity": {
            "schemaVersion": 1,
            "canonicalizationVersion": 1,
            "hashAlgorithm": "sha256",
            "projection": {
              "name": "scip-query:index-generation",
              "version": 1
            },
            "digest": "5f5af108211ca4cbc96039e19fd54c8883c58afac704157b2a864eac2df1349e"
          }
        }
      ],
      "stabilityProofs": [
        {
          "source": "index-generation",
          "kind": "immutable"
        }
      ]
    },
    "analysisManifest": {
      "schemaVersion": 1,
      "evidence": "graph-fact",
      "coverage": {
        "complete": true,
        "totalKnown": true,
        "returned": 1,
        "total": 1,
        "omitted": 0
      },
      "claimQualification": {
        "schemaVersion": 1,
        "origin": "compiler-graph",
        "coverage": {
          "state": "complete",
          "returned": 1,
          "totalKnown": true,
          "total": 1,
          "omitted": 0
        },
        "producerValidation": {
          "status": "not-evaluated"
        },
        "stateAuthority": {
          "policyVersion": 1,
          "authority": "advisory",
          "requiredRelationships": [
            "collaborationDomain",
            "wholeContent",
            "observationStability"
          ],
          "reasons": [
            "collaborationDomain:unknown",
            "wholeContent:unknown",
            "leftIndexAlignment:unknown",
            "rightIndexAlignment:unknown"
          ]
        },
        "repositoryPolicy": {
          "policyId": "scip-query:unresolved-repository-policy",
          "policyVersion": 1,
          "permission": "not-established",
          "reasons": [
            "No repository action policy was supplied for this claim."
          ]
        }
      }
    }
  }
}
