{
  "kind": "scip-query-result",
  "schemaVersion": 1,
  "producer": {
    "name": "scip-query",
    "version": "0.25.0"
  },
  "resultSchemaVersion": 1,
  "command": "duplicate-bodies",
  "operationRole": "repository-observation",
  "evidence": "heuristic",
  "args": [],
  "options": {
    "maxLoc": 15,
    "minLoc": 3,
    "limit": 20,
    "json": true,
    "session": true,
    "jsonOutput": "/Users/aydansalois/Documents/GitHub/scip-query/benchmarks/full-tool-audit/2026-09-05/followup/final/duplicate-bodies.json"
  },
  "result": [
    {
      "hash": "4973ffb05ba54a4a",
      "canonical": {
        "symbol": "scip-typescript npm accuracy-followup 1.0.0 src/duplicate/`a.ts`/formatOne().",
        "shortName": "src:duplicate:a:formatOne()",
        "file": "src/duplicate/a.ts",
        "startLine": 0,
        "endLine": 4,
        "loc": 5,
        "ageCommits": 2
      },
      "functions": [
        {
          "symbol": "scip-typescript npm accuracy-followup 1.0.0 src/duplicate/`a.ts`/formatOne().",
          "shortName": "src:duplicate:a:formatOne()",
          "file": "src/duplicate/a.ts",
          "startLine": 0,
          "endLine": 4,
          "loc": 5,
          "ageCommits": 2
        },
        {
          "symbol": "scip-typescript npm accuracy-followup 1.0.0 src/duplicate/`b.ts`/formatTwo().",
          "shortName": "src:duplicate:b:formatTwo()",
          "file": "src/duplicate/b.ts",
          "startLine": 0,
          "endLine": 4,
          "loc": 5,
          "ageCommits": 2
        }
      ]
    }
  ],
  "coverage": {
    "complete": null,
    "totalKnown": false,
    "returned": 1
  },
  "evidenceContext": {
    "schemaVersion": 1,
    "operationRole": "repository-observation",
    "receipt": {
      "schemaVersion": 2,
      "observedAt": "2026-09-06T03:43:13.654Z",
      "facts": {
        "index": {
          "generation": {
            "schemaVersion": 1,
            "canonicalizationVersion": 1,
            "hashAlgorithm": "sha256",
            "projection": {
              "name": "scip-query:index-generation",
              "version": 1
            },
            "digest": "5f5af108211ca4cbc96039e19fd54c8883c58afac704157b2a864eac2df1349e"
          },
          "source": "immutable"
        }
      },
      "observedSources": [
        {
          "kind": "index-generation",
          "identity": {
            "schemaVersion": 1,
            "canonicalizationVersion": 1,
            "hashAlgorithm": "sha256",
            "projection": {
              "name": "scip-query:index-generation",
              "version": 1
            },
            "digest": "5f5af108211ca4cbc96039e19fd54c8883c58afac704157b2a864eac2df1349e"
          }
        }
      ],
      "stabilityProofs": [
        {
          "source": "index-generation",
          "kind": "immutable"
        }
      ]
    },
    "analysisManifest": {
      "schemaVersion": 1,
      "evidence": "heuristic",
      "coverage": {
        "complete": null,
        "totalKnown": false,
        "returned": 1
      },
      "claimQualification": {
        "schemaVersion": 1,
        "origin": "heuristic",
        "coverage": {
          "state": "unknown",
          "returned": 1,
          "totalKnown": false
        },
        "producerValidation": {
          "status": "not-evaluated"
        },
        "stateAuthority": {
          "policyVersion": 1,
          "authority": "advisory",
          "requiredRelationships": [
            "collaborationDomain",
            "wholeContent",
            "observationStability"
          ],
          "reasons": [
            "collaborationDomain:unknown",
            "wholeContent:unknown",
            "leftIndexAlignment:unknown",
            "rightIndexAlignment:unknown"
          ]
        },
        "repositoryPolicy": {
          "policyId": "scip-query:unresolved-repository-policy",
          "policyVersion": 1,
          "permission": "not-established",
          "reasons": [
            "No repository action policy was supplied for this claim."
          ]
        }
      }
    }
  }
}
