{
  "kind": "scip-query-result",
  "schemaVersion": 1,
  "producer": {
    "name": "scip-query",
    "version": "0.25.0"
  },
  "resultSchemaVersion": 1,
  "command": "outline",
  "operationRole": "repository-observation",
  "evidence": "graph-fact",
  "args": [
    "src/calls.ts"
  ],
  "options": {
    "json": true,
    "session": true,
    "jsonOutput": "/private/tmp/scip-followup-cli/outline.json"
  },
  "result": [
    {
      "symbol": "scip-typescript npm accuracy-followup 1.0.0 src/`calls.ts`/",
      "shortName": "src:calls",
      "startLine": 0,
      "endLine": 13,
      "signature": "module \"calls.ts\"",
      "children": [
        {
          "symbol": "scip-typescript npm accuracy-followup 1.0.0 src/`calls.ts`/helper().",
          "shortName": "src:calls:helper()",
          "startLine": 0,
          "endLine": 0,
          "signature": "function helper(value: number): number",
          "children": []
        },
        {
          "symbol": "scip-typescript npm accuracy-followup 1.0.0 src/`calls.ts`/returnedReference().",
          "shortName": "src:calls:returnedReference()",
          "startLine": 1,
          "endLine": 1,
          "signature": "function returnedReference(): (value: number) => number",
          "children": []
        },
        {
          "symbol": "scip-typescript npm accuracy-followup 1.0.0 src/`calls.ts`/arrayReference().",
          "shortName": "src:calls:arrayReference()",
          "startLine": 2,
          "endLine": 2,
          "signature": "function arrayReference(): ((value: number) => number)[]",
          "children": []
        },
        {
          "symbol": "scip-typescript npm accuracy-followup 1.0.0 src/`calls.ts`/actualCall().",
          "shortName": "src:calls:actualCall()",
          "startLine": 3,
          "endLine": 3,
          "signature": "function actualCall(): number",
          "children": []
        },
        {
          "symbol": "scip-typescript npm accuracy-followup 1.0.0 src/`calls.ts`/nestedOwner().",
          "shortName": "src:calls:nestedOwner()",
          "startLine": 4,
          "endLine": 7,
          "signature": "function nestedOwner(): () => number",
          "children": []
        },
        {
          "symbol": "scip-typescript npm accuracy-followup 1.0.0 src/`calls.ts`/nullish().",
          "shortName": "src:calls:nullish()",
          "startLine": 8,
          "endLine": 8,
          "signature": "function nullish(value: number | null): number",
          "children": []
        },
        {
          "symbol": "scip-typescript npm accuracy-followup 1.0.0 src/`calls.ts`/nestedMetric().",
          "shortName": "src:calls:nestedMetric()",
          "startLine": 9,
          "endLine": 12,
          "signature": "function nestedMetric(value: number): (x: number) => 1 | 0",
          "children": []
        },
        {
          "symbol": "scip-typescript npm accuracy-followup 1.0.0 src/`calls.ts`/sameLineBranches().",
          "shortName": "src:calls:sameLineBranches()",
          "startLine": 13,
          "endLine": 13,
          "signature": "function sameLineBranches(x: boolean): 1 | 0",
          "children": []
        }
      ]
    }
  ],
  "coverage": {
    "complete": true,
    "totalKnown": true,
    "returned": 1,
    "total": 1,
    "omitted": 0
  },
  "evidenceContext": {
    "schemaVersion": 1,
    "operationRole": "repository-observation",
    "receipt": {
      "schemaVersion": 2,
      "observedAt": "2026-09-06T02:48:30.250Z",
      "facts": {
        "index": {
          "generation": {
            "schemaVersion": 1,
            "canonicalizationVersion": 1,
            "hashAlgorithm": "sha256",
            "projection": {
              "name": "scip-query:index-generation",
              "version": 1
            },
            "digest": "9ac14a281194a148cf10c602037b09606e09d9ffe44bb4fa89756a4fd7ab8821"
          },
          "source": "immutable"
        }
      },
      "observedSources": [
        {
          "kind": "index-generation",
          "identity": {
            "schemaVersion": 1,
            "canonicalizationVersion": 1,
            "hashAlgorithm": "sha256",
            "projection": {
              "name": "scip-query:index-generation",
              "version": 1
            },
            "digest": "9ac14a281194a148cf10c602037b09606e09d9ffe44bb4fa89756a4fd7ab8821"
          }
        }
      ],
      "stabilityProofs": [
        {
          "source": "index-generation",
          "kind": "immutable"
        }
      ]
    },
    "analysisManifest": {
      "schemaVersion": 1,
      "evidence": "graph-fact",
      "coverage": {
        "complete": true,
        "totalKnown": true,
        "returned": 1,
        "total": 1,
        "omitted": 0
      },
      "claimQualification": {
        "schemaVersion": 1,
        "origin": "compiler-graph",
        "coverage": {
          "state": "complete",
          "returned": 1,
          "totalKnown": true,
          "total": 1,
          "omitted": 0
        },
        "producerValidation": {
          "status": "not-evaluated"
        },
        "stateAuthority": {
          "policyVersion": 1,
          "authority": "advisory",
          "requiredRelationships": [
            "collaborationDomain",
            "wholeContent",
            "observationStability"
          ],
          "reasons": [
            "collaborationDomain:unknown",
            "wholeContent:unknown",
            "leftIndexAlignment:unknown",
            "rightIndexAlignment:unknown"
          ]
        },
        "repositoryPolicy": {
          "policyId": "scip-query:unresolved-repository-policy",
          "policyVersion": 1,
          "permission": "not-established",
          "reasons": [
            "No repository action policy was supplied for this claim."
          ]
        }
      }
    }
  }
}
