{
  "kind": "scip-query-result",
  "schemaVersion": 1,
  "producer": {
    "name": "scip-query",
    "version": "0.25.0"
  },
  "resultSchemaVersion": 1,
  "command": "code",
  "operationRole": "repository-observation",
  "evidence": "graph-fact",
  "args": [
    "src/service/runner.ts:1-8"
  ],
  "options": {
    "context": 0,
    "members": "exported",
    "json": true,
    "session": true,
    "jsonOutput": "/Users/aydansalois/Documents/GitHub/scip-query/benchmarks/command-contracts/2026-09-05/cli/code.json"
  },
  "result": {
    "matched": true,
    "resolved": {
      "symbol": "scip-typescript npm accuracy-followup 1.0.0 src/service/`runner.ts`/",
      "shortName": "src:service:runner",
      "relativePath": "src/service/runner.ts"
    },
    "otherMatches": [],
    "totalMatches": 1,
    "code": {
      "symbol": "src/service/runner.ts:1-8",
      "shortName": "src/service/runner.ts:1-8",
      "relativePath": "src/service/runner.ts",
      "startLine": 0,
      "endLine": 7,
      "language": "typescript",
      "source": "import { sum } from '../core/math';\nimport { Store } from '../core/store';\nexport function runJob() {\n  const store = new Store();\n  const total = sum(1, 2);\n  store.write(total);\n  return total > 0 ? total : 0;\n}",
      "freshness": {
        "exactText": {
          "state": "current",
          "basis": "working-tree-read",
          "sha256": "47ff65875a88ee0640a1149ae2edb3d8e56a31de61cdebedfdb5d10b8f1f43f8"
        },
        "semantic": {
          "state": "aligned",
          "basis": "indexed-input-fingerprint"
        }
      },
      "bindingClosure": {
        "coverage": "indexed-project-literal-values",
        "inline": []
      }
    }
  },
  "coverage": {
    "complete": true,
    "totalKnown": true,
    "returned": 1,
    "total": 1,
    "omitted": 0,
    "resolution": {
      "state": "exact",
      "totalCandidates": 1
    }
  },
  "evidenceContext": {
    "schemaVersion": 1,
    "operationRole": "repository-observation",
    "receipt": {
      "schemaVersion": 2,
      "observedAt": "2026-09-06T07:47:53.366Z",
      "facts": {
        "index": {
          "generation": {
            "schemaVersion": 1,
            "canonicalizationVersion": 1,
            "hashAlgorithm": "sha256",
            "projection": {
              "name": "scip-query:index-generation",
              "version": 1
            },
            "digest": "5f5af108211ca4cbc96039e19fd54c8883c58afac704157b2a864eac2df1349e"
          },
          "source": "immutable"
        }
      },
      "observedSources": [
        {
          "kind": "index-generation",
          "identity": {
            "schemaVersion": 1,
            "canonicalizationVersion": 1,
            "hashAlgorithm": "sha256",
            "projection": {
              "name": "scip-query:index-generation",
              "version": 1
            },
            "digest": "5f5af108211ca4cbc96039e19fd54c8883c58afac704157b2a864eac2df1349e"
          }
        }
      ],
      "stabilityProofs": [
        {
          "source": "index-generation",
          "kind": "immutable"
        }
      ]
    },
    "analysisManifest": {
      "schemaVersion": 1,
      "evidence": "graph-fact",
      "coverage": {
        "complete": true,
        "totalKnown": true,
        "returned": 1,
        "total": 1,
        "omitted": 0,
        "resolution": {
          "state": "exact",
          "totalCandidates": 1
        }
      },
      "claimQualification": {
        "schemaVersion": 1,
        "origin": "compiler-graph",
        "coverage": {
          "state": "complete",
          "returned": 1,
          "totalKnown": true,
          "total": 1,
          "omitted": 0
        },
        "producerValidation": {
          "status": "not-evaluated"
        },
        "stateAuthority": {
          "policyVersion": 1,
          "authority": "advisory",
          "requiredRelationships": [
            "collaborationDomain",
            "wholeContent",
            "observationStability"
          ],
          "reasons": [
            "collaborationDomain:unknown",
            "wholeContent:unknown",
            "leftIndexAlignment:unknown",
            "rightIndexAlignment:unknown"
          ]
        },
        "repositoryPolicy": {
          "policyId": "scip-query:unresolved-repository-policy",
          "policyVersion": 1,
          "permission": "not-established",
          "reasons": [
            "No repository action policy was supplied for this claim."
          ]
        }
      }
    }
  }
}
