{
  "kind": "scip-query-result",
  "schemaVersion": 1,
  "producer": {
    "name": "scip-query",
    "version": "0.25.0"
  },
  "resultSchemaVersion": 1,
  "command": "affected",
  "operationRole": "repository-observation",
  "evidence": "graph-fact",
  "args": [
    "sum"
  ],
  "options": {
    "json": true,
    "session": true,
    "jsonOutput": "/Users/aydansalois/Documents/GitHub/scip-query/benchmarks/full-tool-audit/2026-09-05/followup/final/affected.json"
  },
  "result": {
    "matched": true,
    "resolved": {
      "symbol": "scip-typescript npm accuracy-followup 1.0.0 src/core/`math.ts`/sum().",
      "shortName": "src:core:math:sum()",
      "relativePath": "src/core/math.ts"
    },
    "otherMatches": [],
    "totalMatches": 1,
    "affected": [
      {
        "symbol": "scip-typescript npm accuracy-followup 1.0.0 src/service/`runner.ts`/runJob().",
        "shortName": "src:service:runner:runJob()",
        "file": "src/service/runner.ts",
        "depth": 1
      },
      {
        "symbol": "scip-typescript npm accuracy-followup 1.0.0 src/`consumer.ts`/main().",
        "shortName": "src:consumer:main()",
        "file": "src/consumer.ts",
        "depth": 2
      }
    ],
    "coverage": {
      "status": "accounted",
      "edgeBasis": "reverse-static-call-or-reference-evidence",
      "maxDepth": 5,
      "reachedDepth": 3,
      "perSymbolEvidenceLimit": 500,
      "remainingFrontierSymbols": 0,
      "reasons": [
        "The discovered reverse evidence frontier was exhausted."
      ]
    }
  },
  "coverage": {
    "complete": null,
    "totalKnown": false,
    "returned": 1,
    "resolution": {
      "state": "exact",
      "totalCandidates": 1
    }
  },
  "evidenceContext": {
    "schemaVersion": 1,
    "operationRole": "repository-observation",
    "receipt": {
      "schemaVersion": 2,
      "observedAt": "2026-09-06T03:42:59.488Z",
      "facts": {
        "index": {
          "generation": {
            "schemaVersion": 1,
            "canonicalizationVersion": 1,
            "hashAlgorithm": "sha256",
            "projection": {
              "name": "scip-query:index-generation",
              "version": 1
            },
            "digest": "5f5af108211ca4cbc96039e19fd54c8883c58afac704157b2a864eac2df1349e"
          },
          "source": "immutable"
        }
      },
      "observedSources": [
        {
          "kind": "index-generation",
          "identity": {
            "schemaVersion": 1,
            "canonicalizationVersion": 1,
            "hashAlgorithm": "sha256",
            "projection": {
              "name": "scip-query:index-generation",
              "version": 1
            },
            "digest": "5f5af108211ca4cbc96039e19fd54c8883c58afac704157b2a864eac2df1349e"
          }
        }
      ],
      "stabilityProofs": [
        {
          "source": "index-generation",
          "kind": "immutable"
        }
      ]
    },
    "analysisManifest": {
      "schemaVersion": 1,
      "evidence": "graph-fact",
      "coverage": {
        "complete": null,
        "totalKnown": false,
        "returned": 1,
        "resolution": {
          "state": "exact",
          "totalCandidates": 1
        }
      },
      "claimQualification": {
        "schemaVersion": 1,
        "origin": "compiler-graph",
        "coverage": {
          "state": "unknown",
          "returned": 1,
          "totalKnown": false
        },
        "producerValidation": {
          "status": "not-evaluated"
        },
        "stateAuthority": {
          "policyVersion": 1,
          "authority": "advisory",
          "requiredRelationships": [
            "collaborationDomain",
            "wholeContent",
            "observationStability"
          ],
          "reasons": [
            "collaborationDomain:unknown",
            "wholeContent:unknown",
            "leftIndexAlignment:unknown",
            "rightIndexAlignment:unknown"
          ]
        },
        "repositoryPolicy": {
          "policyId": "scip-query:unresolved-repository-policy",
          "policyVersion": 1,
          "permission": "not-established",
          "reasons": [
            "No repository action policy was supplied for this claim."
          ]
        }
      }
    }
  }
}
