{
  "kind": "scip-query-result",
  "schemaVersion": 1,
  "producer": {
    "name": "scip-query",
    "version": "0.25.0"
  },
  "resultSchemaVersion": 1,
  "command": "hotspots",
  "operationRole": "repository-observation",
  "evidence": "graph-fact",
  "args": [],
  "options": {
    "limit": 30,
    "json": true,
    "session": true,
    "jsonOutput": "/Users/aydansalois/Documents/GitHub/scip-query/benchmarks/full-tool-audit/2026-09-05/followup/final/hotspots.json"
  },
  "result": [
    {
      "symbol": "scip-typescript npm accuracy-followup 1.0.0 src/cycle/`a.ts`/readA().",
      "shortName": "src:cycle:a:readA()",
      "refCount": 1,
      "fileCount": 1,
      "definedIn": "src/cycle/a.ts",
      "basis": "scip-cross-file-mentions",
      "countUnit": "reference-occurrences"
    },
    {
      "symbol": "scip-typescript npm accuracy-followup 1.0.0 src/cycle/`a.ts`/",
      "shortName": "src:cycle:a",
      "refCount": 1,
      "fileCount": 1,
      "definedIn": "src/cycle/a.ts",
      "basis": "scip-cross-file-mentions",
      "countUnit": "reference-occurrences"
    },
    {
      "symbol": "scip-typescript npm accuracy-followup 1.0.0 src/cycle/`b.ts`/readB().",
      "shortName": "src:cycle:b:readB()",
      "refCount": 1,
      "fileCount": 1,
      "definedIn": "src/cycle/b.ts",
      "basis": "scip-cross-file-mentions",
      "countUnit": "reference-occurrences"
    },
    {
      "symbol": "scip-typescript npm accuracy-followup 1.0.0 src/cycle/`b.ts`/",
      "shortName": "src:cycle:b",
      "refCount": 1,
      "fileCount": 1,
      "definedIn": "src/cycle/b.ts",
      "basis": "scip-cross-file-mentions",
      "countUnit": "reference-occurrences"
    },
    {
      "symbol": "scip-typescript npm accuracy-followup 1.0.0 src/service/`runner.ts`/runJob().",
      "shortName": "src:service:runner:runJob()",
      "refCount": 1,
      "fileCount": 1,
      "definedIn": "src/service/runner.ts",
      "basis": "scip-cross-file-mentions",
      "countUnit": "reference-occurrences"
    },
    {
      "symbol": "scip-typescript npm accuracy-followup 1.0.0 src/service/`runner.ts`/",
      "shortName": "src:service:runner",
      "refCount": 1,
      "fileCount": 1,
      "definedIn": "src/service/runner.ts",
      "basis": "scip-cross-file-mentions",
      "countUnit": "reference-occurrences"
    },
    {
      "symbol": "scip-typescript npm accuracy-followup 1.0.0 src/core/`store.ts`/Store#write().",
      "shortName": "src:core:store:Store:write()",
      "refCount": 1,
      "fileCount": 1,
      "definedIn": "src/core/store.ts",
      "basis": "scip-cross-file-mentions",
      "countUnit": "reference-occurrences"
    },
    {
      "symbol": "scip-typescript npm accuracy-followup 1.0.0 src/core/`store.ts`/Store#",
      "shortName": "src:core:store:Store",
      "refCount": 1,
      "fileCount": 1,
      "definedIn": "src/core/store.ts",
      "basis": "scip-cross-file-mentions",
      "countUnit": "reference-occurrences"
    },
    {
      "symbol": "scip-typescript npm accuracy-followup 1.0.0 src/core/`store.ts`/",
      "shortName": "src:core:store",
      "refCount": 1,
      "fileCount": 1,
      "definedIn": "src/core/store.ts",
      "basis": "scip-cross-file-mentions",
      "countUnit": "reference-occurrences"
    },
    {
      "symbol": "scip-typescript npm accuracy-followup 1.0.0 src/core/`math.ts`/sum().",
      "shortName": "src:core:math:sum()",
      "refCount": 1,
      "fileCount": 1,
      "definedIn": "src/core/math.ts",
      "basis": "scip-cross-file-mentions",
      "countUnit": "reference-occurrences"
    },
    {
      "symbol": "scip-typescript npm accuracy-followup 1.0.0 src/core/`math.ts`/",
      "shortName": "src:core:math",
      "refCount": 1,
      "fileCount": 1,
      "definedIn": "src/core/math.ts",
      "basis": "scip-cross-file-mentions",
      "countUnit": "reference-occurrences"
    }
  ],
  "coverage": {
    "complete": null,
    "totalKnown": false,
    "returned": 11
  },
  "evidenceContext": {
    "schemaVersion": 1,
    "operationRole": "repository-observation",
    "receipt": {
      "schemaVersion": 2,
      "observedAt": "2026-09-06T03:42:54.028Z",
      "facts": {
        "index": {
          "generation": {
            "schemaVersion": 1,
            "canonicalizationVersion": 1,
            "hashAlgorithm": "sha256",
            "projection": {
              "name": "scip-query:index-generation",
              "version": 1
            },
            "digest": "5f5af108211ca4cbc96039e19fd54c8883c58afac704157b2a864eac2df1349e"
          },
          "source": "immutable"
        }
      },
      "observedSources": [
        {
          "kind": "index-generation",
          "identity": {
            "schemaVersion": 1,
            "canonicalizationVersion": 1,
            "hashAlgorithm": "sha256",
            "projection": {
              "name": "scip-query:index-generation",
              "version": 1
            },
            "digest": "5f5af108211ca4cbc96039e19fd54c8883c58afac704157b2a864eac2df1349e"
          }
        }
      ],
      "stabilityProofs": [
        {
          "source": "index-generation",
          "kind": "immutable"
        }
      ]
    },
    "analysisManifest": {
      "schemaVersion": 1,
      "evidence": "graph-fact",
      "coverage": {
        "complete": null,
        "totalKnown": false,
        "returned": 11
      },
      "claimQualification": {
        "schemaVersion": 1,
        "origin": "compiler-graph",
        "coverage": {
          "state": "unknown",
          "returned": 11,
          "totalKnown": false
        },
        "producerValidation": {
          "status": "not-evaluated"
        },
        "stateAuthority": {
          "policyVersion": 1,
          "authority": "advisory",
          "requiredRelationships": [
            "collaborationDomain",
            "wholeContent",
            "observationStability"
          ],
          "reasons": [
            "collaborationDomain:unknown",
            "wholeContent:unknown",
            "leftIndexAlignment:unknown",
            "rightIndexAlignment:unknown"
          ]
        },
        "repositoryPolicy": {
          "policyId": "scip-query:unresolved-repository-policy",
          "policyVersion": 1,
          "permission": "not-established",
          "reasons": [
            "No repository action policy was supplied for this claim."
          ]
        }
      }
    }
  }
}
