{
  "kind": "scip-query-result",
  "schemaVersion": 1,
  "producer": {
    "name": "scip-query",
    "version": "0.25.0"
  },
  "resultSchemaVersion": 1,
  "command": "react-hook-candidates",
  "operationRole": "repository-observation",
  "evidence": "heuristic",
  "args": [],
  "options": {
    "minSimilarity": 0.45,
    "minSharedBehaviors": 6,
    "limit": 20,
    "scope": "missing-directory/",
    "json": true,
    "session": true,
    "jsonOutput": "/Users/aydansalois/Documents/GitHub/scip-query/benchmarks/command-contracts/2026-09-05/frontend/react-hook-candidates-missing.json"
  },
  "result": [],
  "coverage": {
    "complete": null,
    "totalKnown": false,
    "returned": 1
  },
  "evidenceContext": {
    "schemaVersion": 1,
    "operationRole": "repository-observation",
    "receipt": {
      "schemaVersion": 2,
      "observedAt": "2026-09-06T07:19:01.112Z",
      "facts": {
        "collaborationDomain": {
          "schemaVersion": 1,
          "canonicalizationVersion": 1,
          "hashAlgorithm": "sha256",
          "projection": {
            "name": "scip-query:collaboration-domain",
            "version": 1
          },
          "digest": "12b3d23d2bb3429c31aff20478764eb784d8f792f1d99fd05b8c3f595352050f"
        },
        "index": {
          "generation": {
            "schemaVersion": 1,
            "canonicalizationVersion": 1,
            "hashAlgorithm": "sha256",
            "projection": {
              "name": "scip-query:index-generation",
              "version": 1
            },
            "digest": "050446cf722ece59bcdf455aec02944e1025b9368d62ea8201c3fa71a0d5ad3a"
          },
          "source": "immutable"
        }
      },
      "observedSources": [
        {
          "kind": "index-generation",
          "identity": {
            "schemaVersion": 1,
            "canonicalizationVersion": 1,
            "hashAlgorithm": "sha256",
            "projection": {
              "name": "scip-query:index-generation",
              "version": 1
            },
            "digest": "050446cf722ece59bcdf455aec02944e1025b9368d62ea8201c3fa71a0d5ad3a"
          }
        }
      ],
      "stabilityProofs": [
        {
          "source": "index-generation",
          "kind": "immutable"
        }
      ]
    },
    "analysisManifest": {
      "schemaVersion": 1,
      "evidence": "heuristic",
      "coverage": {
        "complete": null,
        "totalKnown": false,
        "returned": 1
      },
      "claimQualification": {
        "schemaVersion": 1,
        "origin": "heuristic",
        "coverage": {
          "state": "unknown",
          "returned": 1,
          "totalKnown": false
        },
        "producerValidation": {
          "status": "not-evaluated"
        },
        "stateAuthority": {
          "policyVersion": 1,
          "authority": "advisory",
          "requiredRelationships": [
            "collaborationDomain",
            "wholeContent",
            "observationStability"
          ],
          "reasons": [
            "wholeContent:unknown",
            "leftIndexAlignment:unknown",
            "rightIndexAlignment:unknown"
          ]
        },
        "repositoryPolicy": {
          "policyId": "scip-query:unresolved-repository-policy",
          "policyVersion": 1,
          "permission": "not-established",
          "reasons": [
            "No repository action policy was supplied for this claim."
          ]
        }
      }
    }
  }
}
